{
  "$schema": "../schemas/component.schema.json",
  "schemaVersion": 1,
  "id": "scroll-overlay",
  "layer": "organism",
  "selector": "app-scroll-overlay",
  "export": "ScrollOverlayComponent",
  "source": "src/app/shared/ui/organisms/scroll-overlay/scroll-overlay.component.ts",
  "relatedSources": [
    "src/app/shared/ui/organisms/scroll-overlay/scroll-overlay.component.html",
    "src/app/shared/ui/organisms/scroll-overlay/scroll-overlay.component.css"
  ],
  "purpose": "Contenedor que sincroniza scroll horizontal y vertical con indicadores overlay y alineación opcional de tablas.",
  "variants": [],
  "inputs": [
    {
      "name": "horizontal",
      "type": "boolean",
      "default": true,
      "meaning": "Habilita el eje horizontal del viewport."
    },
    {
      "name": "vertical",
      "type": "boolean",
      "default": true,
      "meaning": "Habilita el eje vertical del viewport."
    },
    {
      "name": "fill",
      "type": "boolean",
      "default": false,
      "meaning": "El overlay ocupa la altura disponible de su contenedor."
    },
    {
      "name": "focusable",
      "type": "boolean",
      "default": false,
      "meaning": "Hace enfocable el viewport para que el teclado pueda desplazarlo."
    },
    {
      "name": "viewportRole",
      "type": "string | null",
      "default": null,
      "meaning": "Rol ARIA aplicado al elemento que realmente scrollea."
    },
    {
      "name": "ariaLabel",
      "type": "string | null",
      "default": null,
      "meaning": "Nombre accesible del viewport."
    },
    {
      "name": "autoHide",
      "type": "boolean",
      "default": true,
      "meaning": "Oculta las barras cuando no hay interaccion."
    },
    {
      "name": "maxHeight",
      "type": "string | number | null",
      "default": null,
      "meaning": "Altura maxima del viewport; un numero se interpreta en pixeles."
    }
  ],
  "outputs": [],
  "slots": [
    {
      "name": "default",
      "type": "projected content",
      "meaning": "Tabla o contenido desplazable contenido por el overlay."
    }
  ],
  "behavior": [
    "Ignora candidatos de scroll pertenecientes a un ScrollOverlay anidado.",
    "Oculta el scrollbar nativo en cada scroller horizontal o vertical administrado, incluso durante la medición temporal de columnas.",
    "ResizeObserver y MutationObserver agrupan la sincronización de geometría en un único animation frame.",
    "Muestra los thumbs durante scroll, wheel, touch, hover o drag y los oculta después de autoHideDelay.",
    "Al destruirse cancela timers, listeners, observers, animation frames y atributos temporales."
  ],
  "states": [
    {
      "name": "no-overflow",
      "meaning": "Oculta ambos indicadores cuando el contenido cabe."
    },
    {
      "name": "overflow-x",
      "meaning": "Presenta y sincroniza el indicador horizontal."
    },
    {
      "name": "overflow-y",
      "meaning": "Presenta y sincroniza el indicador vertical."
    },
    {
      "name": "scrolling",
      "meaning": "Mantiene visibles los indicadores durante interacción."
    },
    {
      "name": "table-sync",
      "meaning": "Alinea encabezado y cuerpo usando una plantilla medida o bloqueada."
    },
    {
      "name": "axis-disabled",
      "meaning": "Una o ambas orientaciones se excluyen explícitamente."
    }
  ],
  "a11y": [
    "Los tracks y thumbs son decorativos y se excluyen con aria-hidden.",
    "El contenido proyectado conserva su semántica y debe proporcionar su propio nombre accesible.",
    "La implementación actual no hace los thumbs operables por teclado ni añade tabindex al área de scroll."
  ],
  "responsive": [
    "El host limita su ancho al contenedor y el área interna puede desplazarse en ambos ejes.",
    "A 768px o menos elimina el borde y radio externos de las tablas detectadas.",
    "No controla el reflujo semántico de tablas; solo su geometría y desplazamiento."
  ],
  "tokens": [
    "--border-color",
    "--radius-full",
    "--so-body-height",
    "--so-max-height",
    "--so-min-column-width",
    "--so-scroll-end-space",
    "--so-thumb-blur",
    "--so-thumb-color-active",
    "--so-thumb-color-end",
    "--so-thumb-color-hover",
    "--so-thumb-color-start",
    "--so-track-size",
    "--space-1",
    "--space-2",
    "--space-8",
    "--table-border-radius",
    "--table-color-border"
  ],
  "story": {
    "path": "src/stories/ui-scroll-overlay.stories.ts",
    "status": "available"
  },
  "test": {
    "path": "src/app/shared/ui/organisms/scroll-overlay/scroll-overlay.component.spec.ts",
    "status": "available"
  },
  "stability": {
    "status": "candidate",
    "notes": [
      "La implementación usa ViewEncapsulation.None y no declara ChangeDetectionStrategy.OnPush.",
      "La prueba automatizada cubre coalescencia de geometría, aislamiento anidado y ocultamiento del scrollbar nativo, pero no drag, teclado ni todos los modos de tabla."
    ]
  },
  "canonicalFor": [
    "scroll-overlay",
    "table-scroll-indicator",
    "two-axis-scroll",
    "layout-scroll-owner",
    "dialog-scroll-owner",
    "navigation-scroll-owner"
  ]
}
