{
  "$schema": "../schemas/component.schema.json",
  "schemaVersion": 1,
  "id": "form-select",
  "layer": "atom",
  "selector": "app-select",
  "export": "SelectComponent",
  "source": "src/app/shared/ui/atoms/select/select.component.ts",
  "purpose": "Selección canónica (SelectComponent) de una opción con etiqueta superior o flotante, ayuda, error y soporte CVA.",
  "variants": [
    {
      "name": "label-mode",
      "appliesWhen": "hay label",
      "values": [
        { "value": "standard", "meaning": "Etiqueta superior fija sobre el control; el marcador siempre se ve.", "default": true },
        { "value": "floating", "meaning": "Etiqueta dentro del control que sube al enfocar o cuando hay valor; el marcador se oculta mientras la etiqueta reposa." },
        { "value": "floating-value", "meaning": "Etiqueta dentro del control que sube solo cuando hay valor; enfocar un campo vacio no la mueve." }
      ]
    },
    {
      "name": "option-value-type",
      "values": [
        { "value": "string", "meaning": "Valor textual de la opción.", "default": true },
        { "value": "number", "meaning": "Valor numérico preservado por CVA." }
      ]
    }
  ],
  "inputs": [
    {
      "name": "options",
      "type": "readonly SelectOption[]",
      "default": [],
      "meaning": "Opciones value/label; cada opción puede estar disabled."
    },
    { "name": "selected", "type": "string | number | null", "default": null, "meaning": "Selección controlada que prevalece sobre el valor CVA interno." },
    { "name": "label", "type": "string", "default": "", "meaning": "Etiqueta visible del select." },
    { "name": "variant", "type": "'standard' | 'floating' | 'floating-value'", "default": "standard", "meaning": "Modo de etiqueta comun a todos los controles: superior fija, flotante al enfocar o con valor, o flotante solo con valor." },
    { "name": "ariaLabel", "type": "string | null", "default": null, "meaning": "Nombre accesible cuando no hay label visible." },
    { "name": "placeholder", "type": "string", "default": "Seleccione", "meaning": "Opción inicial sin valor." },
    { "name": "error", "type": "string | null", "default": null, "meaning": "Mensaje de error y origen de aria-invalid." },
    { "name": "hint", "type": "string | null", "default": null, "meaning": "Ayuda relacionada por aria-describedby." },
    { "name": "disabled", "type": "boolean", "default": false, "meaning": "Deshabilita desde input; CVA también puede hacerlo." },
    { "name": "required", "type": "boolean", "default": false, "meaning": "Marca selección obligatoria." },
    { "name": "controlId", "type": "string | null", "default": null, "meaning": "Id explícito; si falta se genera uno estable por instancia." }
  ],
  "outputs": [
    { "name": "selectionChange", "type": "string", "meaning": "Valor serializado emitido por el evento change nativo." }
  ],
  "behavior": [
    "Implementa ControlValueAccessor y conserva string o number al resolver una opción conocida.",
    "Si la selección ya no existe en options, mantiene una opción legacy para no ocultar el dato persistido.",
    "Con etiqueta flotante la ayuda y el error viven fuera de la caja del control, de modo que la etiqueta se centra solo contra el campo.",
    "Sin label no hay etiqueta flotante y el marcador se conserva."
  ],
  "states": [
    { "name": "placeholder", "meaning": "No hay opción elegida." },
    { "name": "selected", "meaning": "Presenta la etiqueta de la opción activa." },
    { "name": "legacy-option", "meaning": "Conserva un valor seleccionado ausente del catálogo actual." },
    { "name": "error", "meaning": "Presenta mensaje y aria-invalid." },
    { "name": "disabled", "meaning": "Bloqueado por input o setDisabledState." },
    { "name": "required", "meaning": "Expone obligatoriedad nativa y accesible." },
    { "name": "floating-resting", "meaning": "Etiqueta flotante dentro del control, sin valor ni enfoque; el marcador permanece oculto." },
    { "name": "floating-elevated", "meaning": "Etiqueta flotante sobre el borde superior; el marcador ya se muestra." }
  ],
  "a11y": [
    "Asocia label y select mediante for e id, o usa ariaLabel y finalmente placeholder como respaldo.",
    "Expone aria-required, aria-invalid y aria-describedby para ayuda o error.",
    "Respeta disabled nativo tanto en el control como en opciones individuales.",
    "La etiqueta flotante es un label real asociado por for e id; no se sustituye por el marcador."
  ],
  "responsive": [
    "Ocupa el ancho del contenedor y no define quiebres de viewport propios."
  ],
  "tokens": [
    "--control-height",
    "--danger-color",
    "--field-label-color",
    "--field-label-color-error",
    "--field-label-color-floated",
    "--field-label-duration",
    "--field-label-floated-font-size",
    "--field-label-floated-font-weight",
    "--field-label-font-size",
    "--field-label-font-weight",
    "--field-label-gap",
    "--field-label-inset",
    "--field-label-line-height",
    "--field-label-padding",
    "--input-bg",
    "--input-border",
    "--input-border-focus",
    "--input-border-hover",
    "--input-disabled-bg",
    "--input-disabled-text",
    "--input-placeholder",
    "--input-shadow",
    "--input-shadow-focus",
    "--input-shadow-hover",
    "--input-text",
    "--radius-md",
    "--shadow-sm",
    "--space-1",
    "--space-3",
    "--space-4",
    "--space-7",
    "--space-8",
    "--text-color",
    "--text-color-muted",
    "--text-sm",
    "--text-xs"
  ],
  "story": {
    "path": "src/stories/ui-select.stories.ts",
    "status": "available"
  },
  "test": {
    "path": "src/app/shared/ui/atoms/select/select-variant.spec.ts",
    "status": "available"
  },
  "stability": {
    "status": "stable",
    "notes": [
      "SelectComponent es la implementación única; Select, prest-select y app-form-select se conservan como alias de compatibilidad."
    ]
  },
  "canonicalFor": [
    "form-select",
    "single-selection",
    "catalog-selection"
  ],
  "relatedExports": [
    "Select"
  ],
  "relatedSources": [
    "src/app/shared/ui/atoms/form-select/select.ts"
  ]
}
